{
  "schema_version": "1.0.0",
  "origin": "BEY",
  "destination": "IST",
  "depart_date_from": "2026-09-10",
  "depart_date_to": "2026-09-10",
  "passenger_count": 1,
  "cabin_class": "economy",
  "is_snapshot": true,
  "searched_at": "2026-08-01T12:00:00Z",
  "options": [
    {
      "schema_version": "1.0.0",
      "flight_id": "flight_syn_001",
      "origin": "BEY",
      "destination": "IST",
      "depart_at": "2026-09-10T06:30:00Z",
      "arrive_at": "2026-09-10T08:15:00Z",
      "carrier": "SyntheticAir",
      "stops": 0,
      "price": { "amount_minor_units": 450000, "currency": "TRY" },
      "provenance": {
        "schema_version": "1.0.0",
        "provider": "synthetic-fixture-flight-provider",
        "data_mode": "fixture",
        "retrieved_at": "2026-08-01T12:00:00Z",
        "source_urls": []
      }
    }
  ],
  "limitations": []
}
